{
  "$schema": "https://json-schema.org/draft/2020-12/schema",
  "$id": "https://registry.stancatti.dev/schemas/resource.schema.json",
  "title": "Skills Registry resource",
  "type": "object",
  "additionalProperties": false,
  "required": ["schemaVersion", "kind", "id", "projectId", "collectionId", "slug", "type", "publication", "official", "editorial", "source", "installationVariants", "recommendedVersionId"],
  "properties": {
    "schemaVersion": { "const": "1.0.0" },
    "kind": { "const": "resource" },
    "id": { "$ref": "#/$defs/uuid" },
    "projectId": { "$ref": "#/$defs/uuid" },
    "collectionId": { "anyOf": [{ "$ref": "#/$defs/uuid" }, { "type": "null" }] },
    "slug": { "$ref": "#/$defs/slug" },
    "type": { "enum": ["skill", "skill-pack", "mcp-server", "plugin", "prompt-pack"] },
    "publication": {
      "type": "object",
      "additionalProperties": false,
      "required": ["status", "publishedAt", "archivedAt"],
      "properties": {
        "status": { "enum": ["active", "deprecated"] },
        "publishedAt": { "$ref": "#/$defs/timestamp" },
        "archivedAt": { "anyOf": [{ "$ref": "#/$defs/timestamp" }, { "type": "null" }] }
      }
    },
    "official": {
      "type": "object",
      "additionalProperties": false,
      "required": ["name", "description", "homepageUrl", "repositoryUrl", "maintainer", "license"],
      "properties": {
        "name": { "type": "string", "minLength": 1, "maxLength": 160 },
        "description": { "type": "string", "minLength": 1, "maxLength": 10000 },
        "homepageUrl": { "$ref": "#/$defs/httpsUrl" },
        "repositoryUrl": { "$ref": "#/$defs/httpsUrl" },
        "maintainer": { "$ref": "#/$defs/maintainer" },
        "license": { "$ref": "#/$defs/license" }
      }
    },
    "editorial": { "$ref": "#/$defs/editorial" },
    "source": {
      "type": "object",
      "additionalProperties": false,
      "required": ["repositoryUrl", "monitoredPath", "versionStrategy", "packageName", "tagPattern", "candidatePolicy", "includeExperimental"],
      "properties": {
        "repositoryUrl": { "$ref": "#/$defs/httpsUrl" },
        "monitoredPath": { "type": "string", "pattern": "^(?:\\.|[A-Za-z0-9._-]+(?:/[A-Za-z0-9._-]+)*)$", "maxLength": 240 },
        "versionStrategy": { "enum": ["github-release", "git-tag", "package-release", "commit-path"] },
        "packageName": { "anyOf": [{ "type": "string", "pattern": "^@?[A-Za-z0-9._-]+(?:/[A-Za-z0-9._-]+)?$", "maxLength": 160 }, { "type": "null" }] },
        "tagPattern": { "anyOf": [{ "type": "string", "maxLength": 300 }, { "type": "null" }] },
        "candidatePolicy": { "enum": ["stable", "promoted", "opt-in"] },
        "includeExperimental": { "type": "boolean" }
      }
    },
    "installationVariants": { "type": "array", "items": { "$ref": "#/$defs/installationVariant" }, "minItems": 1, "maxItems": 30 },
    "recommendedVersionId": { "$ref": "#/$defs/uuid" }
  },
  "$defs": {
    "uuid": { "type": "string", "pattern": "^[0-9a-f]{8}-[0-9a-f]{4}-[1-5][0-9a-f]{3}-[89ab][0-9a-f]{3}-[0-9a-f]{12}$" },
    "slug": { "type": "string", "pattern": "^[a-z0-9]+(?:-[a-z0-9]+)*$", "minLength": 1, "maxLength": 80 },
    "httpsUrl": { "type": "string", "pattern": "^https://[^\\s]+$", "maxLength": 2048 },
    "timestamp": { "type": "string", "pattern": "^\\d{4}-\\d{2}-\\d{2}T\\d{2}:\\d{2}:\\d{2}(?:\\.\\d{3})?Z$" },
    "maintainer": {
      "type": "object", "additionalProperties": false, "required": ["name", "url"],
      "properties": { "name": { "type": "string", "minLength": 1, "maxLength": 160 }, "url": { "$ref": "#/$defs/httpsUrl" } }
    },
    "license": {
      "type": "object", "additionalProperties": false, "required": ["spdx", "name", "url", "redistribution", "noticePaths"],
      "properties": {
        "spdx": { "type": "string", "pattern": "^[A-Za-z0-9.+-]{1,40}$" },
        "name": { "type": "string", "minLength": 1, "maxLength": 160 },
        "url": { "$ref": "#/$defs/httpsUrl" },
        "redistribution": { "enum": ["allowed", "link-only"] },
        "noticePaths": { "type": "array", "items": { "type": "string", "pattern": "^(?!/)(?!.*(?:^|/)\\.\\.(?:/|$))[A-Za-z0-9._/-]{1,240}$" }, "minItems": 1, "uniqueItems": true, "maxItems": 20 }
      }
    },
    "editorial": {
      "type": "object", "additionalProperties": false, "required": ["descriptionPtBr", "notesPtBr", "tags"],
      "properties": {
        "descriptionPtBr": { "type": "string", "minLength": 1, "maxLength": 4000 },
        "notesPtBr": { "anyOf": [{ "type": "string", "maxLength": 4000 }, { "type": "null" }] },
        "tags": { "type": "array", "items": { "type": "string", "pattern": "^[a-z0-9]+(?:-[a-z0-9]+)*$", "maxLength": 40 }, "uniqueItems": true, "maxItems": 30 }
      }
    },
    "installationVariant": {
      "type": "object", "additionalProperties": false,
      "required": ["key", "target", "label", "kind", "command", "url", "steps", "warningPtBr", "officialSourceUrl"],
      "properties": {
        "key": { "type": "string", "pattern": "^[a-z0-9]+(?:-[a-z0-9]+)*$", "maxLength": 60 },
        "target": { "enum": ["claude-code", "cursor", "codex", "copilot", "gemini", "pi", "opencode", "mcp-client", "generic"] },
        "label": { "type": "string", "minLength": 1, "maxLength": 160 },
        "kind": { "enum": ["command", "url", "steps"] },
        "command": { "anyOf": [{ "type": "string", "minLength": 1, "maxLength": 1000 }, { "type": "null" }] },
        "url": { "anyOf": [{ "$ref": "#/$defs/httpsUrl" }, { "type": "null" }] },
        "steps": { "anyOf": [{ "type": "array", "items": { "type": "string", "minLength": 1, "maxLength": 2000 }, "minItems": 1, "maxItems": 20 }, { "type": "null" }] },
        "warningPtBr": { "anyOf": [{ "type": "string", "maxLength": 2000 }, { "type": "null" }] },
        "officialSourceUrl": { "$ref": "#/$defs/httpsUrl" }
      },
      "allOf": [
        { "if": { "properties": { "kind": { "const": "command" } } }, "then": { "required": ["command"], "properties": { "command": { "type": "string" }, "url": { "type": "null" }, "steps": { "type": "null" } } } },
        { "if": { "properties": { "kind": { "const": "url" } } }, "then": { "required": ["url"], "properties": { "command": { "type": "null" }, "url": { "type": "string" }, "steps": { "type": "null" } } } },
        { "if": { "properties": { "kind": { "const": "steps" } } }, "then": { "required": ["steps"], "properties": { "command": { "type": "null" }, "url": { "type": "null" }, "steps": { "type": "array" } } } }
      ]
    }
  }
}
