{"schemaVersion":"1.0.0","kind":"resource","id":"11111111-1111-4111-8111-111111111113","projectId":"11111111-1111-4111-8111-111111111111","collectionId":"11111111-1111-4111-8111-111111111112","slug":"mattpocock-skills","type":"skill-pack","publication":{"status":"active","publishedAt":"2026-08-21T21:25:33Z","archivedAt":null},"official":{"name":"Matt Pocock Skills","description":"Skills for Real Engineers, distributed as Agent Skills and a Claude Code plugin.","homepageUrl":"https://aihero.dev/skills","repositoryUrl":"https://github.com/mattpocock/skills","maintainer":{"name":"Matt Pocock","url":"https://www.aihero.dev"},"license":{"spdx":"MIT","name":"MIT License","url":"https://github.com/mattpocock/skills/blob/v1.2.3/LICENSE","redistribution":"allowed","noticePaths":["LICENSE"]}},"editorial":{"descriptionPtBr":"Pacote de skills promovidas para engenharia de software e produtividade.","notesPtBr":"A instalação via plugin Claude e via Skills CLI é alternativa. Não instale os dois métodos simultaneamente para evitar duplicação.","tags":["skills","engenharia","produtividade","claude-code"]},"source":{"repositoryUrl":"https://github.com/mattpocock/skills","monitoredPath":"skills","versionStrategy":"github-release","packageName":"mattpocock-skills","tagPattern":"^v\\d+\\.\\d+\\.\\d+$","candidatePolicy":"promoted","includeExperimental":false},"installationVariants":[{"key":"setup","target":"generic","label":"Configuração pós-instalação","kind":"command","command":"/setup-matt-pocock-skills","url":null,"steps":null,"warningPtBr":null,"officialSourceUrl":"https://github.com/mattpocock/skills"},{"key":"skills-cli","target":"generic","label":"Skills CLI","kind":"command","command":"npx skills@latest add mattpocock/skills","url":null,"steps":null,"warningPtBr":"Não instale este método junto com o plugin Claude; os recursos seriam duplicados.","officialSourceUrl":"https://github.com/mattpocock/skills"}],"recommendedVersionId":"fa366dc0-2327-4a51-b0cf-0280a5a1aef0"}