{"schemaVersion":"1.0.0","kind":"resource","id":"05ab9b7b-6de4-48b6-83ef-e1ee301a7808","projectId":"f5a75356-8765-4191-a05e-5d28f4d71a46","collectionId":"390ef641-29f7-4d9f-ab95-fd87e20cc132","slug":"obra-superpowers-brainstorm-server","type":"skill-pack","publication":{"status":"active","publishedAt":"2026-08-19T07:04:41Z","archivedAt":null},"official":{"name":"brainstorm-server","description":"{\n  \"name\": \"brainstorm-server-tests\",\n  \"version\": \"1.0.0\",\n  \"scripts\": {\n    \"test\": \"node ws-protocol.test.js && node helper.test.js && node browser-launcher.test.js && node auth.test.js && node branding.test.js && node server.test.js && node lifecycle.test.js && bash start-server.test.sh && bash stop-server.test.sh\"\n  },\n  \"dependencies\": {\n    \"ws\": \"^8.21.0\"\n  }\n}\n","homepageUrl":"https://github.com/obra/superpowers","repositoryUrl":"https://github.com/obra/superpowers","maintainer":{"name":"brainstorm-server","url":"https://github.com/obra/superpowers"},"license":{"spdx":"MIT","name":"MIT License","url":"https://github.com/obra/superpowers/blob/main/LICENSE","redistribution":"allowed","noticePaths":["LICENSE"]}},"editorial":{"descriptionPtBr":"brainstorm-server","notesPtBr":null,"tags":["skill-pack"]},"source":{"repositoryUrl":"https://github.com/obra/superpowers","monitoredPath":"tests/brainstorm-server/package.json","versionStrategy":"commit-path","packageName":null,"tagPattern":null,"candidatePolicy":"stable","includeExperimental":false},"installationVariants":[{"key":"official","target":"generic","label":"Official installation","kind":"steps","command":null,"url":null,"steps":["Consulte a documentação oficial para instalar este recurso."],"warningPtBr":null,"officialSourceUrl":"https://github.com/obra/superpowers"}],"recommendedVersionId":"7b447059-450b-4db0-8fe7-20010aac7ac8"}