{"schemaVersion":"1.0.0","kind":"resource","id":"11111111-1111-4111-8111-111111111114","projectId":"11111111-1111-4111-8111-111111111111","collectionId":"11111111-1111-4111-8111-111111111112","slug":"mattpocock-skills-plugin","type":"plugin","publication":{"status":"active","publishedAt":"2026-08-21T21:25:33Z","archivedAt":null},"official":{"name":"Matt Pocock Skills Claude Plugin","description":"The Matt Pocock Skills collection packaged for Claude Code's plugin channel.","homepageUrl":"https://claude.com/plugins/mattpocock-skills","repositoryUrl":"https://github.com/mattpocock/skills","maintainer":{"url":"https://www.aihero.dev","name":"Matt Pocock"},"license":{"spdx":"MIT","name":"MIT License","url":"https://github.com/mattpocock/skills/blob/v1.2.3/LICENSE","redistribution":"allowed","noticePaths":["LICENSE"]}},"editorial":{"descriptionPtBr":"Canal de plugin Claude Code para as skills de Matt Pocock.","notesPtBr":"Use o plugin ou a cópia via Skills CLI, nunca os dois ao mesmo tempo.","tags":["plugin","claude-code","skills"]},"source":{"repositoryUrl":"https://github.com/mattpocock/skills","monitoredPath":".","versionStrategy":"github-release","packageName":"mattpocock-skills","tagPattern":"^v\\d+\\.\\d+\\.\\d+$","candidatePolicy":"stable","includeExperimental":false},"installationVariants":[{"key":"claude-marketplace","target":"claude-code","label":"Claude Code Marketplace","kind":"command","command":"claude plugins install mattpocock-skills","url":null,"steps":null,"warningPtBr":"Não instale também a variante Skills CLI neste mesmo ambiente.","officialSourceUrl":"https://claude.com/plugins/mattpocock-skills"},{"key":"plugin-command","target":"claude-code","label":"Comando do plugin","kind":"command","command":"/plugin install mattpocock-skills","url":null,"steps":null,"warningPtBr":null,"officialSourceUrl":"https://github.com/mattpocock/skills"}],"recommendedVersionId":"604390f4-95fe-468b-956b-7cf2bfed951b"}