{
  "schemaVersion": "1.0.0",
  "kind": "resource",
  "id": "22222222-2222-4222-8222-222222222225",
  "projectId": "22222222-2222-4222-8222-222222222222",
  "collectionId": "22222222-2222-4222-8222-222222222223",
  "slug": "context7-cli-skills",
  "type": "skill-pack",
  "publication": { "status": "active", "publishedAt": "2026-08-19T00:00:00Z", "archivedAt": null },
  "official": {
    "name": "Context7 CLI and Skills",
    "description": "The Context7 CLI package and repository skills for documentation lookup workflows.",
    "homepageUrl": "https://context7.com/docs/clients/cli",
    "repositoryUrl": "https://github.com/upstash/context7",
    "maintainer": { "name": "Upstash, Inc.", "url": "https://github.com/upstash" },
    "license": { "spdx": "MIT", "name": "MIT License", "url": "https://github.com/upstash/context7/blob/master/LICENSE", "redistribution": "allowed", "noticePaths": ["LICENSE"] }
  },
  "editorial": {
    "descriptionPtBr": "CLI ctx7 e skills oficiais para consultar documentação atualizada.",
    "notesPtBr": "O catálogo separa esta linha de versão da linha do servidor MCP.",
    "tags": ["context7", "cli", "skills", "documentacao"]
  },
  "source": { "repositoryUrl": "https://github.com/upstash/context7", "monitoredPath": "packages/cli", "versionStrategy": "package-release", "packageName": "ctx7", "tagPattern": "^ctx7@", "candidatePolicy": "stable", "includeExperimental": false },
  "installationVariants": [
    { "key": "setup", "target": "generic", "label": "Setup oficial", "kind": "command", "command": "npx ctx7 setup --cli", "url": null, "steps": null, "warningPtBr": null, "officialSourceUrl": "https://context7.com/docs/clients/cli" },
    { "key": "npx", "target": "generic", "label": "CLI via npx", "kind": "command", "command": "npx ctx7@latest", "url": null, "steps": null, "warningPtBr": null, "officialSourceUrl": "https://github.com/upstash/context7" }
  ],
  "recommendedVersionId": "22222222-2222-4222-8222-222222222228"
}
