{"schemaVersion":"1.0.0","kind":"resource","id":"b8f78c66-db8a-4016-9a4d-76dd8101f4b2","projectId":"f5a75356-8765-4191-a05e-5d28f4d71a46","collectionId":"390ef641-29f7-4d9f-ab95-fd87e20cc132","slug":"obra-superpowers-claude-plugin","type":"plugin","publication":{"status":"active","publishedAt":"2026-08-19T07:04:41Z","archivedAt":null},"official":{"name":".claude-plugin","description":"{\n  \"name\": \"superpowers\",\n  \"description\": \"Core skills library for Claude Code: TDD, debugging, collaboration patterns, and proven techniques\",\n  \"version\": \"6.3.0\",\n  \"author\": {\n    \"name\": \"Jesse Vincent\",\n    \"email\": \"jesse@fsck.com\"\n  },\n  \"homepage\": \"https://github.com/obra/superpowers\",\n  \"repository\": \"https://github.com/obra/superpowers\",\n  \"license\": \"MIT\",\n  \"keywords\": [\n    \"skills\",\n    \"tdd\",\n    \"debugging\",\n    \"collaboration\",\n    \"best-practices\",\n    \"workflows\"\n  ]\n}\n","homepageUrl":"https://github.com/obra/superpowers","repositoryUrl":"https://github.com/obra/superpowers","maintainer":{"name":".claude-plugin","url":"https://github.com/obra/superpowers"},"license":{"spdx":"MIT","name":"MIT License","url":"https://github.com/obra/superpowers/blob/main/LICENSE","redistribution":"allowed","noticePaths":["LICENSE"]}},"editorial":{"descriptionPtBr":".claude-plugin","notesPtBr":null,"tags":["plugin"]},"source":{"repositoryUrl":"https://github.com/obra/superpowers","monitoredPath":".claude-plugin/plugin.json","versionStrategy":"commit-path","packageName":null,"tagPattern":null,"candidatePolicy":"stable","includeExperimental":false},"installationVariants":[{"key":"official","target":"generic","label":"Official installation","kind":"steps","command":null,"url":null,"steps":["Consulte a documentação oficial para instalar este recurso."],"warningPtBr":null,"officialSourceUrl":"https://github.com/obra/superpowers"}],"recommendedVersionId":"4b1d4f28-a0e0-48b6-a234-087c3570ab4d"}