{"schemaVersion":"1.0.0","kind":"resource","id":"e47809af-954b-4099-907c-66a803a28f65","projectId":"f5a75356-8765-4191-a05e-5d28f4d71a46","collectionId":"390ef641-29f7-4d9f-ab95-fd87e20cc132","slug":"obra-superpowers-executing-plans","type":"skill","publication":{"status":"active","publishedAt":"2026-08-19T07:04:41Z","archivedAt":null},"official":{"name":"executing-plans","description":"---\nname: executing-plans\ndescription: Use when you have a written implementation plan to execute in a separate session with review checkpoints\n---\n\n# Executing Plans\n\n## Overview\n\nLoad plan, review critically, execute all tasks, report when complete.\n\n**Announce at start:** \"I'm using the executing-plans skill to implement this plan.\"\n\n**Note:** Tell your human partner that Superpowers works much better with access to subagents (Claude Code, Codex CLI, Codex App, Copilot CLI, and Gemini CLI all qualify; see the per-platform tool refs in `../using-superpowers/references/`). If subagents are available, use superpowers:subagent-driven-development instead of this skill.\n\n## The Process\n\n### Step 1: Load and Review Plan\n1. Ensure an isolated workspace: use superpowers:using-git-worktrees to create one or verify the existing one\n2. Read plan file\n3. Review critically - identify any questions or concerns about the plan\n4. If concerns: Raise them with your human partner before starting\n5. If no concerns: Create todos for the plan items and proceed\n\n### Step 2: Execute Tasks\n\nFor each task:\n1. Mark as in_progress\n2. Follow each step exactly (plan has bite-sized steps)\n3. Run verifications as specified\n4. Mark as completed\n\n### Step 3: Complete Development\n\nAfter all tasks complete and verified:\n- Announce: \"I'm using the finishing-a-development-branch skill to complete this work.\"\n- **REQUIRED SUB-SKILL:** Use superpowers:finishing-a-development-branch\n- Follow that skill to verify tests, present options, execute choice\n\n## When to Stop and Ask for Help\n\n**STOP executing immediately when:**\n- Hit a blocker (missing dependency, test fails, instruction unclear)\n- Plan has critical gaps preventing starting\n- You don't understand an instruction\n- Verification fails repeatedly\n\n**Ask for clarification rather than guessing.**\n\n## When to Revisit Earlier Steps\n\n**Return to Review (Step 1) when:**\n- Partner updates the plan based on your feedback\n- Fundamental approach needs rethinking\n\n**Don't force through blockers** - stop and ask.\n\n## Remember\n- Review plan critically first\n- Follow plan steps exactly\n- Don't skip verifications\n- Reference skills when plan says to\n- Stop when blocked, don't guess\n- Never start implementation on main/master branch without explicit user consent\n","homepageUrl":"https://github.com/obra/superpowers","repositoryUrl":"https://github.com/obra/superpowers","maintainer":{"name":"executing-plans","url":"https://github.com/obra/superpowers"},"license":{"spdx":"MIT","name":"MIT License","url":"https://github.com/obra/superpowers/blob/main/LICENSE","redistribution":"allowed","noticePaths":["LICENSE"]}},"editorial":{"descriptionPtBr":"executing-plans","notesPtBr":null,"tags":["skill"]},"source":{"repositoryUrl":"https://github.com/obra/superpowers","monitoredPath":"skills/executing-plans/SKILL.md","versionStrategy":"commit-path","packageName":null,"tagPattern":null,"candidatePolicy":"stable","includeExperimental":false},"installationVariants":[{"key":"official","target":"generic","label":"Official installation","kind":"steps","command":null,"url":null,"steps":["Consulte a documentação oficial para instalar este recurso."],"warningPtBr":null,"officialSourceUrl":"https://github.com/obra/superpowers"}],"recommendedVersionId":"1b6d9a5a-e9b6-4a61-b1c6-718637b5792b"}