{"schemaVersion":"1.0.0","kind":"resource","id":"22222222-2222-4222-8222-222222222224","projectId":"22222222-2222-4222-8222-222222222222","collectionId":"22222222-2222-4222-8222-222222222223","slug":"context7-mcp","type":"mcp-server","publication":{"status":"active","publishedAt":"2026-08-21T21:25:32Z","archivedAt":null},"official":{"name":"Context7 MCP","description":"The Context7 MCP server package and client configuration for up-to-date documentation.","homepageUrl":"https://context7.com","repositoryUrl":"https://github.com/upstash/context7","maintainer":{"name":"Upstash, Inc.","url":"https://github.com/upstash"},"license":{"spdx":"MIT","name":"MIT License","url":"https://github.com/upstash/context7/blob/master/LICENSE","redistribution":"allowed","noticePaths":["LICENSE"]}},"editorial":{"descriptionPtBr":"Servidor MCP do Context7, com versões independentes do CLI e dos plugins.","notesPtBr":"O serviço hospedado, o corpus e o backend privado não são redistribuídos pelo registry.","tags":["context7","mcp","documentacao"]},"source":{"repositoryUrl":"https://github.com/upstash/context7","monitoredPath":"packages/mcp","versionStrategy":"package-release","packageName":"@upstash/context7-mcp","tagPattern":"^@upstash/context7-mcp@","candidatePolicy":"stable","includeExperimental":false},"installationVariants":[{"key":"local","target":"mcp-client","label":"Servidor local","kind":"command","command":"npx -y @upstash/context7-mcp","url":null,"steps":null,"warningPtBr":null,"officialSourceUrl":"https://github.com/upstash/context7"},{"key":"remote","target":"mcp-client","label":"Servidor remoto","kind":"url","command":null,"url":"https://mcp.context7.com/mcp","steps":null,"warningPtBr":"O serviço remoto pode exigir uma API key do Context7.","officialSourceUrl":"https://context7.com/docs/resources/all-clients"},{"key":"setup","target":"generic","label":"Assistente oficial","kind":"command","command":"npx ctx7 setup --mcp","url":null,"steps":null,"warningPtBr":null,"officialSourceUrl":"https://context7.com/docs/clients/cli"}],"recommendedVersionId":"9b21c17e-5e83-46a9-922b-300d9ea7c115"}